[
  {
    "qa_id": "qa_0001",
    "doc_id": "AAPL_10K_2023",
    "company": "AAPL",
    "filing_year": 2023,
    "filing_type": "10-K",
    "question": "What was Apple's total revenue growth percentage from fiscal year 2022 to 2023, and which product segment contributed most to the change?",
    "answer": "Apple's total revenue declined 2.8% from $394.3B in FY2022 to $383.3B in FY2023. The iPhone segment remained the largest contributor at $200.6B despite a 2.3% decline.",
    "answer_numeric": -2.8,
    "supporting_pages": [30, 31, 45],
    "question_type": "cross_page_trend",
    "modalities_used": ["text", "table"],
    "difficulty": "medium",
    "annotator_id": "annotator_01"
  },
  {
    "qa_id": "qa_0002",
    "doc_id": "AAPL_10K_2023",
    "company": "AAPL",
    "filing_year": 2023,
    "filing_type": "10-K",
    "question": "How did Apple's operating expenses compare to gross profit margin across the last three reported fiscal years?",
    "answer": "Gross profit margin improved from 43.3% in FY2021 to 44.1% in FY2023, while total operating expenses grew from $43.3B to $54.8B over the same period.",
    "answer_numeric": null,
    "supporting_pages": [32, 33, 34, 46],
    "question_type": "cross_page_comparison",
    "modalities_used": ["text", "table", "chart"],
    "difficulty": "hard",
    "annotator_id": "annotator_02"
  },
  {
    "qa_id": "qa_0003",
    "doc_id": "MSFT_10K_2023",
    "company": "MSFT",
    "filing_year": 2023,
    "filing_type": "10-K",
    "question": "What was Microsoft's capital expenditure in FY2023 and how does it relate to their cloud revenue growth?",
    "answer": "Microsoft's CapEx was $28.1B in FY2023, up 30% YoY, directly supporting Intelligent Cloud revenue growth of 19% to $87.9B.",
    "answer_numeric": 28.1,
    "supporting_pages": [55, 62, 78],
    "question_type": "cross_page_numeric",
    "modalities_used": ["text", "table"],
    "difficulty": "medium",
    "annotator_id": "annotator_01"
  },
  {
    "qa_id": "qa_0004",
    "doc_id": "NVDA_10K_2023",
    "company": "NVDA",
    "filing_year": 2023,
    "filing_type": "10-K",
    "question": "How did NVIDIA's data center revenue growth compare to the gaming segment decline as shown in both the financial tables and the business overview narrative?",
    "answer": "Data Center revenue surged 217% to $47.5B while Gaming declined 27% to $9.0B. Management cited AI infrastructure demand in the business overview as the primary driver.",
    "answer_numeric": null,
    "supporting_pages": [12, 40, 41, 52],
    "question_type": "table_text_fusion",
    "modalities_used": ["text", "table", "chart"],
    "difficulty": "hard",
    "annotator_id": "annotator_03"
  },
  {
    "qa_id": "qa_0005",
    "doc_id": "JPM_10K_2022",
    "company": "JPM",
    "filing_year": 2022,
    "filing_type": "10-K",
    "question": "What was JPMorgan's net interest income in 2022 compared to 2021, and what risk factors on later pages explain the change?",
    "answer": "Net interest income rose 23% to $56.5B in 2022 from $45.9B in 2021. Risk factors on page 38 cite rising interest rates and credit loss provisions as key drivers.",
    "answer_numeric": 56.5,
    "supporting_pages": [22, 38, 45],
    "question_type": "cross_page_trend",
    "modalities_used": ["text", "table", "xbrl"],
    "difficulty": "medium",
    "annotator_id": "annotator_02"
  }
]
